[
  {
    "id": "sindresorhus-ky",
    "name": "sindresorhus/ky",
    "url": "https://github.com/sindresorhus/ky",
    "license": "MIT",
    "primary_language": "TypeScript",
    "last_activity_checked_at": "2026-05-08T00:00:00.000Z",
    "setup_command": "npm install",
    "test_command": "npm test",
    "build_command": "npm run build",
    "notes": "Public TypeScript HTTP client. Candidate issues are limited to API behavior, documentation, and testable compatibility reports; no network-service credentials should be needed beyond local test fixtures.",
    "status": "candidate"
  },
  {
    "id": "tj-commander-js",
    "name": "tj/commander.js",
    "url": "https://github.com/tj/commander.js",
    "license": "MIT",
    "primary_language": "JavaScript",
    "last_activity_checked_at": "2026-05-08T00:00:00.000Z",
    "setup_command": "npm install",
    "test_command": "npm test",
    "build_command": "npm run lint",
    "notes": "Public JavaScript CLI library. Candidate issues focus on parser, output, and test behavior that should be locally reproducible without hosted services.",
    "status": "candidate"
  },
  {
    "id": "pypa-pipx",
    "name": "pypa/pipx",
    "url": "https://github.com/pypa/pipx",
    "license": "MIT",
    "primary_language": "Python",
    "last_activity_checked_at": "2026-05-08T00:00:00.000Z",
    "setup_command": "python -m pip install -e .",
    "test_command": "python -m pytest",
    "build_command": "python -m pip install -e .",
    "notes": "Public Python CLI tool. Candidate issues are local CLI, packaging, and test-suite behavior; avoid issues requiring private indexes or distribution credentials.",
    "status": "candidate"
  },
  {
    "id": "go-task-task",
    "name": "go-task/task",
    "url": "https://github.com/go-task/task",
    "license": "MIT",
    "primary_language": "Go",
    "last_activity_checked_at": "2026-05-08T00:00:00.000Z",
    "setup_command": "go mod download",
    "test_command": "go test ./...",
    "build_command": "go build ./cmd/task",
    "notes": "Public Go task runner. Candidate issues are CLI/taskfile behavior reports that should be validated with local fixtures and Go tests.",
    "status": "candidate"
  },
  {
    "id": "markdownlint-markdownlint",
    "name": "markdownlint/markdownlint",
    "url": "https://github.com/markdownlint/markdownlint",
    "license": "MIT",
    "primary_language": "Ruby",
    "last_activity_checked_at": "2026-05-08T00:00:00.000Z",
    "setup_command": "bundle install",
    "test_command": "bundle exec rake test",
    "build_command": "bundle exec rake install",
    "notes": "Public Markdown linting CLI. Included as docs tooling even though the implementation language is Ruby; candidate issues are rule false positives and line-number behavior with small Markdown fixtures.",
    "status": "candidate"
  },
  {
    "id": "ljharb-qs",
    "name": "ljharb/qs",
    "url": "https://github.com/ljharb/qs",
    "license": "BSD-3-Clause",
    "primary_language": "JavaScript",
    "last_activity_checked_at": "2026-05-08T00:00:00.000Z",
    "setup_command": "npm install --no-audit --no-fund",
    "test_command": "npm test",
    "build_command": "npm test",
    "notes": "Public JavaScript query string parser/stringifier. Batch 003 preflight verified clone, npm install, and npm test at a0a81ea2071acce3eff41a040f719ac8f5c4f64c.",
    "status": "candidate"
  },
  {
    "id": "yargs-yargs",
    "name": "yargs/yargs",
    "url": "https://github.com/yargs/yargs",
    "license": "MIT",
    "primary_language": "TypeScript",
    "last_activity_checked_at": "2026-05-08T00:00:00.000Z",
    "setup_command": "npm install --no-audit --no-fund",
    "test_command": "npm run compile -- -p tsconfig.test.json && npx mocha --enable-source-maps ./test/*.mjs --require ./test/before.mjs --timeout=24000 --check-leaks",
    "build_command": "npm run compile",
    "notes": "Public TypeScript CLI argument parser. Batch 003 preflight verified clone, install, compile, and main Mocha suite at 437f3a4e0f4166e1f1a3ce023b0331159582746d; full npm test posttest check is partially blocked by existing Prettier formatting errors.",
    "status": "candidate"
  }
]
